title,content,category
أساسيات البرمجة,البرمجة هي عملية كتابة التعليمات البرمجية للحاسوب لتنفيذ مهام محددة. تشمل المفاهيم الأساسية المتغيرات والحلقات والشروط والدوال. البرمجة تتطلب التفكير المنطقي وحل المشكلات.,برمجة
لغة بايثون,بايثون هي لغة برمجة عالية المستوى سهلة التعلم. تستخدم في تطوير الويب والذكاء الاصطناعي وتحليل البيانات. تتميز بقراءتها السهلة ومكتباتها الواسعة.,برمجة
قواعد البيانات,قواعد البيانات هي أنظمة لتخزين وإدارة البيانات بشكل منظم. تشمل الأنواع SQL مثل MySQL و PostgreSQL و NoSQL مثل MongoDB. تستخدم لحفظ بيانات التطبيقات والمواقع.,قواعد بيانات
الذكاء الاصطناعي,الذكاء الاصطناعي هو مجال في علوم الحاسوب يهدف لإنشاء أنظمة ذكية. يشمل التعلم الآلي ومعالجة اللغات الطبيعية ورؤية الحاسوب. يستخدم في السيارات الذاتية والمساعدين الصوتيين.,ذكاء اصطناعي
التعلم الآلي,التعلم الآلي هو فرع من الذكاء الاصطناعي حيث تتعلم الأنظمة من البيانات. يشمل التعلم الموجه وغير الموجه والتعزيزي. يستخدم في التوصيات والتنبؤات وتحليل الصور.,ذكاء اصطناعي
أمن المعلومات,أمن المعلومات يحمي البيانات والأنظمة من الهجمات. يشمل التشفير والمصادقة والجدران النارية. مهم لحماية المعلومات الشخصية والمالية من الاختراق.,أمن
الحوسبة السحابية,الحوسبة السحابية توفر موارد الحوسبة عبر الإنترنت. مزودو الخدمة يشملون AWS و Azure و Google Cloud. تتيح المرونة وتوفير التكاليف والوصول من أي مكان.,سحابة
تطوير الويب,تطوير الويب يشمل إنشاء مواقع وتطبيقات الإنترنت. يتضمن HTML و CSS و JavaScript للواجهة الأمامية و PHP و Python للخلفية. يتطلب فهم بروتوكولات HTTP والخوادم.,تطوير ويب
تطبيقات الجوال,تطوير تطبيقات الجوال يشمل Android و iOS. الأدوات تشمل Flutter و React Native للتطوير المتعدد المنصات. التطبيقات تحتاج اختبار على أجهزة متعددة.,تطبيقات
شبكات الحاسوب,شبكات الحاسوب تربط الأجهزة لتبادل البيانات. تشمل المفاهيم IP و TCP و DNS و HTTP. الشبكات مهمة لتشغيل الإنترنت والاتصالات الداخلية للشركات.,شبكات
إدارة المشاريع,إدارة مشاريع البرمجيات تشمل منهجيات مثل Agile و Scrum. تتضمن التخطيط والتنفيذ والمتابعة والإغلاق. أدوات مثل Jira و Trello تساعد في تنظيم العمل.,إدارة
اختبار البرمجيات,اختبار البرمجيات يضمن جودة المنتج وخلوه من الأخطاء. يشمل الاختبار الوحدوي واختبار التكامل واختبار النظام. الاختبار الآلي يوفر الوقت ويحسن الدقة.,جودة
DevOps,ديف أوبس يجمع بين التطوير والعمليات. يشمل التكامل المستمر والنشر المستمر والأتمتة. أدوات مثل Docker و Kubernetes و Jenkins تسهل العملية.,ديف أوبس
تحليل البيانات,تحليل البيانات يستخرج الرؤى من مجموعات البيانات الكبيرة. يستخدم Python و R و SQL للتحليل. التصور البياني مهم لعرض النتائج بشكل مفهوم.,بيانات
البلوك تشين,البلوك تشين هي تقنية السجل الموزع اللامركزي. تستخدم في العملات الرقمية مثل البيتكوين والعقود الذكية. توفر الشفافية والأمان في المعاملات.,تقنية
